{
  "$schema": "https://json-schema.org/draft/2020-12/schema",
  "$id": "https://zerostack.dev/schemas/harness-report.schema.json",
  "title": "ZeroStack canonical conformance harness report",
  "type": "object",
  "additionalProperties": false,
  "required": [
    "ns",
    "bin",
    "contract_version",
    "surface",
    "completion_status",
    "passed",
    "checks",
    "provenance"
  ],
  "properties": {
    "ns": {
      "enum": [
        "fz",
        "tz",
        "gz"
      ]
    },
    "bin": {
      "type": "string",
      "minLength": 1
    },
    "contract_version": {
      "enum": [
        "1.0",
        "raw-worker-v2"
      ]
    },
    "surface": {
      "enum": [
        "planner",
        "codemode",
        "mcp"
      ]
    },
    "completion_status": {
      "enum": [
        "complete",
        "partial",
        "failed"
      ]
    },
    "passed": {
      "type": "boolean"
    },
    "checks": {
      "type": "array",
      "items": {
        "type": "object",
        "additionalProperties": false,
        "required": [
          "id",
          "name",
          "passed",
          "status",
          "details"
        ],
        "properties": {
          "id": {
            "enum": [
              "G1",
              "G2",
              "G3",
              "G4",
              "G5",
              "G6",
              "G7",
              "G8",
              "G9",
              "G10",
              "RW1",
              "RW2",
              "RW3",
              "RW4",
              "RW5",
              "RW6",
              "RW7",
              "RW8",
              "RW9",
              "RW10"
            ]
          },
          "name": {
            "type": "string",
            "minLength": 1
          },
          "passed": {
            "type": "boolean"
          },
          "status": {
            "enum": [
              "pass",
              "fail",
              "skipped"
            ]
          },
          "skip_reason": {
            "type": "string",
            "minLength": 1
          },
          "details": {
            "type": "array",
            "items": {
              "type": "string"
            }
          }
        },
        "allOf": [
          {
            "if": {
              "properties": {
                "status": {
                  "const": "skipped"
                }
              },
              "required": [
                "status"
              ]
            },
            "then": {
              "required": [
                "skip_reason"
              ]
            }
          },
          {
            "if": {
              "properties": {
                "status": {
                  "const": "pass"
                }
              },
              "required": [
                "status"
              ]
            },
            "then": {
              "properties": {
                "passed": {
                  "const": true
                }
              }
            },
            "else": {
              "properties": {
                "passed": {
                  "const": false
                }
              }
            }
          }
        ]
      }
    },
    "provenance": {
      "type": "object",
      "additionalProperties": false,
      "required": [
        "source_head",
        "hub_head",
        "artifact_sha256",
        "artifact_bytes",
        "checks_digest",
        "pass_count",
        "fail_count",
        "skip_count"
      ],
      "properties": {
        "source_head": {
          "type": "string",
          "pattern": "^[0-9a-f]{40,64}$"
        },
        "hub_head": {
          "type": "string",
          "pattern": "^[0-9a-f]{40,64}$"
        },
        "artifact_sha256": {
          "type": "string",
          "pattern": "^[0-9a-f]{64}$"
        },
        "artifact_bytes": {
          "type": "integer",
          "minimum": 0
        },
        "checks_digest": {
          "type": "string",
          "pattern": "^[0-9a-f]{64}$"
        },
        "pass_count": {
          "type": "integer",
          "minimum": 0
        },
        "fail_count": {
          "type": "integer",
          "minimum": 0
        },
        "skip_count": {
          "type": "integer",
          "minimum": 0
        }
      }
    }
  },
  "allOf": [
    {
      "if": {
        "properties": {
          "surface": {
            "const": "planner"
          }
        },
        "required": [
          "surface"
        ]
      },
      "then": {
        "allOf": [
          {
            "properties": {
              "checks": {
                "contains": {
                  "type": "object",
                  "properties": {
                    "id": {
                      "const": "G1"
                    }
                  },
                  "required": [
                    "id"
                  ]
                },
                "maxContains": 1
              }
            }
          },
          {
            "properties": {
              "checks": {
                "contains": {
                  "type": "object",
                  "properties": {
                    "id": {
                      "const": "G2"
                    }
                  },
                  "required": [
                    "id"
                  ]
                },
                "maxContains": 1
              }
            }
          },
          {
            "properties": {
              "checks": {
                "contains": {
                  "type": "object",
                  "properties": {
                    "id": {
                      "const": "G3"
                    }
                  },
                  "required": [
                    "id"
                  ]
                },
                "maxContains": 1
              }
            }
          },
          {
            "properties": {
              "checks": {
                "contains": {
                  "type": "object",
                  "properties": {
                    "id": {
                      "const": "G4"
                    }
                  },
                  "required": [
                    "id"
                  ]
                },
                "maxContains": 1
              }
            }
          },
          {
            "properties": {
              "checks": {
                "contains": {
                  "type": "object",
                  "properties": {
                    "id": {
                      "const": "G5"
                    }
                  },
                  "required": [
                    "id"
                  ]
                },
                "maxContains": 1
              }
            }
          },
          {
            "properties": {
              "checks": {
                "contains": {
                  "type": "object",
                  "properties": {
                    "id": {
                      "const": "G6"
                    }
                  },
                  "required": [
                    "id"
                  ]
                },
                "maxContains": 1
              }
            }
          },
          {
            "properties": {
              "checks": {
                "contains": {
                  "type": "object",
                  "properties": {
                    "id": {
                      "const": "G7"
                    }
                  },
                  "required": [
                    "id"
                  ]
                },
                "maxContains": 1
              }
            }
          },
          {
            "properties": {
              "checks": {
                "contains": {
                  "type": "object",
                  "properties": {
                    "id": {
                      "const": "G8"
                    }
                  },
                  "required": [
                    "id"
                  ]
                },
                "maxContains": 1
              }
            }
          },
          {
            "properties": {
              "checks": {
                "contains": {
                  "type": "object",
                  "properties": {
                    "id": {
                      "const": "G9"
                    }
                  },
                  "required": [
                    "id"
                  ]
                },
                "maxContains": 1
              }
            }
          },
          {
            "properties": {
              "checks": {
                "contains": {
                  "type": "object",
                  "properties": {
                    "id": {
                      "const": "G10"
                    }
                  },
                  "required": [
                    "id"
                  ]
                },
                "maxContains": 1
              }
            }
          }
        ]
      }
    },
    {
      "if": {
        "properties": {
          "surface": {
            "const": "codemode"
          }
        },
        "required": [
          "surface"
        ]
      },
      "then": {
        "allOf": [
          {
            "properties": {
              "checks": {
                "contains": {
                  "type": "object",
                  "properties": {
                    "id": {
                      "const": "RW1"
                    }
                  },
                  "required": [
                    "id"
                  ]
                },
                "maxContains": 1
              }
            }
          },
          {
            "properties": {
              "checks": {
                "contains": {
                  "type": "object",
                  "properties": {
                    "id": {
                      "const": "RW2"
                    }
                  },
                  "required": [
                    "id"
                  ]
                },
                "maxContains": 1
              }
            }
          },
          {
            "properties": {
              "checks": {
                "contains": {
                  "type": "object",
                  "properties": {
                    "id": {
                      "const": "RW3"
                    }
                  },
                  "required": [
                    "id"
                  ]
                },
                "maxContains": 1
              }
            }
          },
          {
            "properties": {
              "checks": {
                "contains": {
                  "type": "object",
                  "properties": {
                    "id": {
                      "const": "RW4"
                    }
                  },
                  "required": [
                    "id"
                  ]
                },
                "maxContains": 1
              }
            }
          },
          {
            "properties": {
              "checks": {
                "contains": {
                  "type": "object",
                  "properties": {
                    "id": {
                      "const": "RW5"
                    }
                  },
                  "required": [
                    "id"
                  ]
                },
                "maxContains": 1
              }
            }
          },
          {
            "properties": {
              "checks": {
                "contains": {
                  "type": "object",
                  "properties": {
                    "id": {
                      "const": "RW6"
                    }
                  },
                  "required": [
                    "id"
                  ]
                },
                "maxContains": 1
              }
            }
          },
          {
            "properties": {
              "checks": {
                "contains": {
                  "type": "object",
                  "properties": {
                    "id": {
                      "const": "RW7"
                    }
                  },
                  "required": [
                    "id"
                  ]
                },
                "maxContains": 1
              }
            }
          },
          {
            "properties": {
              "checks": {
                "contains": {
                  "type": "object",
                  "properties": {
                    "id": {
                      "const": "RW8"
                    }
                  },
                  "required": [
                    "id"
                  ]
                },
                "maxContains": 1
              }
            }
          },
          {
            "properties": {
              "checks": {
                "contains": {
                  "type": "object",
                  "properties": {
                    "id": {
                      "const": "RW9"
                    }
                  },
                  "required": [
                    "id"
                  ]
                },
                "maxContains": 1
              }
            }
          },
          {
            "properties": {
              "checks": {
                "contains": {
                  "type": "object",
                  "properties": {
                    "id": {
                      "const": "RW10"
                    }
                  },
                  "required": [
                    "id"
                  ]
                },
                "maxContains": 1
              }
            }
          }
        ]
      }
    }
  ]
}
